{
  "Attributes": "example-value",
  "ClockRate": "example-value",
  "Description": "Example MediaConnect flow for live video transport",
  "Fmt": "example-value",
  "MediaStreamId": "id-abc123",
  "MediaStreamName": "example-mediaconnect-flow",
  "MediaStreamType": "standard",
  "VideoFormat": "example-value"
}